{"$schema":"https://json-schema.org/draft/2020-12/schema","$id":"https://code-review-harness/schemas/strategic-scoring-method-manifest.schema.json","title":"Strategic Scoring Method Manifest","type":"object","additionalProperties":false,"required":["method_id","method_version","created_at","scope_id","declared_by","normalization","weights","aggregation","missingness","confidence","sensitivity","composite_allowed","threshold_context","method_hash"],"properties":{"method_id":{"type":"string","format":"uuid"},"method_version":{"const":"1.0.0"},"created_at":{"type":"string","format":"date-time"},"scope_id":{"type":"string"},"declared_by":{"type":"object","additionalProperties":false,"required":["authority_role","authority_name"],"properties":{"authority_role":{"enum":["scoring-method-owner","project-owner"]},"authority_name":{"type":"string"},"subject_id":{"type":"string"},"authority_registry":{"$ref":"#/$defs/registry"}}},"normalization":{"const":"identity_0_1"},"weights":{"type":"object","minProperties":1,"additionalProperties":{"type":"number","minimum":0,"maximum":1}},"aggregation":{"const":"weighted_mean"},"missingness":{"const":"preserve_unknown_no_imputation"},"confidence":{"enum":["preserve_source_confidence","confidence_in_bounded_evidence_insufficiency_not_strategic_approval"]},"measure_mappings":{"type":"object","minProperties":1,"additionalProperties":{"type":"object"}},"confidence_derivation":{"type":"object","additionalProperties":false,"required":["evidence_coverage","component_confidence","assessment_confidence","reconciliation"],"properties":{"evidence_coverage":{"const":"observed_measure_count_divided_by_eligible_measure_count"},"component_confidence":{"const":"preserve_source_assessment_confidence"},"assessment_confidence":{"const":"minimum_observed_source_confidence"},"reconciliation":{"const":"confidence_applies_to_bounded_insufficiency_not_strategic_approval"}}},"sensitivity":{"type":"object","additionalProperties":false,"required":["weight_delta"],"properties":{"weight_delta":{"type":"number","minimum":0,"maximum":0.25}}},"composite_allowed":{"const":false},"threshold_context":{"type":"null"},"method_hash":{"$ref":"#/$defs/hash"}},"$defs":{"hash":{"type":"string","pattern":"^sha256:[0-9a-f]{64}$"},"registry":{"type":"object","additionalProperties":false,"required":["registry_id","registry_version","registry_hash"],"properties":{"registry_id":{"type":"string"},"registry_version":{"type":"string"},"registry_hash":{"$ref":"#/$defs/hash"}}}}}
